Analysis of the VA Patient Population Affected by Monkeypox,Monkeypox in Veterans Affairs Healthcare System,Epidemiology,VA,Domestic,Planning,"1) Creating research team  

2) Designing study – December 31, 2022",2023-03-31T00:00:00.000,"Description and comparison of unique populations affected by monkeypox:  1) test positive and treated 2) test positive and untreated 3) test negatives 4) test negatives and re-tested positively 3) indeterminant tests 4) inconclusive tests 5) presented for symptoms but untested. Outcomes include laboratory markers, genome wide sequencing, viral lineage/drug resistance/phylogenetics risk characteristics, clinical course, sequelae of illness. This study will provide information about test performance and illness course, but also help us understand characteristics of individuals presenting for testing to inform testing strategies, including timing for retesting and the value of testing with exposure but without symptoms."
Biorepository System,Veterans Affairs Science and Health Initiative to Combat Infectious and Emerging Life-Threatening Diseases (VA SHIELD),Epidemiology,VA/VHA,Domestic,Initiated,"Specimens collected; Specimens used for research – December 31, 2022",Ongoing part of VA’s research pandemic preparedness actions,"VA SHIELD collects de-identified biological samples from U.S. Veterans affected by emerging life-threatening health conditions. Associated clinical and demographic information is maintained in a data repository, to help correlate samples and experimental findings with patient demographics, clinical experience and management, vaccinations, and comorbidities. Specimens are available to investigators within and outside VA via an efficient, secure, vetted distribution system."
Monitoring International Monkeypox Infections,No formal research protocol – monitoring the epidemic among people living with HIV/AIDS to determine whether additional support is needed,Epidemiology,DOS/S/GAC,"International: Countries with PEPFAR programs (Angola, Benin, Botswana, Brazil, Burkina Faso, Burma, Burundi, Cambodia, Cameroon, Cote d’Ivoire, Dominican Republic, DRC, El Salvador, Eswatini, Ethiopia, Ghana, Guatemala, Guyana, Haiti, Honduras, India, Indonesia, Jamaica, Kenya, Kyrgyz Republic, Kazakhstan, Laos, Lesotho, Liberia, Malawi, Mali, Mozambique, Namibia, Nepal, Nicaragua, Nigeria, Panama, Papua New Guinea, Philippines, Rwanda, Senegal, Sierra Leone, South Africa, South Sudan, Tajikistan, Tanzania, Thailand, Togo, Trinidad and Tobago, Uganda, Ukraine, Vietnam, Zambia, Zimbabwe)",Ongoing,None,TBD,"Through communication with U.S. Government in-country staff, the office of the Global AIDS Coordinator is monitoring the impact of the monkeypox virus outbreak in endemic and non-endemic countries on President’s Emergency Plan for AIDS Relief (PEPFAR) beneficiaries and programs."
International Training and equipment upgrades/maintenance,Enhancing Biosafety and Biosecurity of High Containment Facilities at the Institut National de Recherche Biomédicale (INRB),Education,DOS/ISN,International: DRC,Ongoing,In-person workshop in October 2022,End of December 2022,"Through a series of virtual biosafety and biosecurity trainings participants will be trained on biorisk management and will develop an institutional biosafety and biosecurity program plan. This effort will build institutionalized capacity at the INRB to ensure that equipment in laboratories working with and storing high-consequence pathogens, such as monkeypox virus, is operating optimally and with all necessary biosafety and biosecurity considerations."
"Structural biology studies in support of vaccine and molecular therapeutics development [Vaccine, Therapeutic]",X-ray crystallography studies at the Advanced Photon Source,"Vaccine, Therapeutic",DOE,Domestic,Ongoing,,,"Most protein structures deposited in the Protein Data Base (PDB) for monkey pox have come from Department of Energy light sources, including the Advanced Photon Source (Argonne), the Advanced Light Source (Lawrence Berkeley) and Stanford Synchrotron Radiation Light Source (SLAC).  In addition, the Advanced Photon Source (ANL) has three on-going studies with users: 1) Harvard Medical School, Dana-Farber Cancer Institute is conducting structural biology research related to how poxviruses evade the host anti-viral immune response and on an unpublished poxvirus protein structure; 2) Scripps Research Institute is working on monkeypox antigenic proteins; 3) Versiti Blood Research Institute, Medical College of Wisconsin is working monkeypox virus protein structures. This work will lead to the development of new vaccines and anti-viral drugs."
"Structural biology studies in support of vaccine and molecular therapeutics development [Vaccine, Therapeutic]",X-ray crystallography studies at the Stanford Synchrotron Radiation Lightsource (SSRL),"Vaccine, Therapeutic",DOE,Domestic,Ongoing,,,"Stanford Synchrotron Radiation Light Source at SLAC has a several on-going studies of Poxviridae.  The Division of Cell Biology, La Jolla Institute for Allergy and Immunology have studied the structural aspects of the vaccinia virus and its interaction with various antibodies. Live Vaccinia virus elicits antibodies to smallpox and monkeypox but does not replicate efficiently in humans. The virus is used to produce the two vaccines currently approved by the CDC for the prevention of monkeypox.  Crystals of proteins related to monkeypox virus are being prepared for structural studies to assess this issue.   Other SSRL users are beginning research programs with the goal of therapeutics developments to combat monkeypox and related poxviridae.  This work will lead to the development of new monkeypox vaccines and antiviral drugs."
Computational studies of phylogeny and predicting structures of all the monkey pox proteins,Computational studies of monkey pox protein and emerging variants,Epidemiology,DOE,Domestic,Ongoing,,,"Argonne (in a collaboration with University of Chicago, University of Virginia and J. Craig Venter Institute) is conducting monkeypox studies for an NIAID-supported center Bioinformatics Resource Center [BV-BRC https://www.bv-brc.org] that includes studies of phylogeny, predicting structures of all the monkeypox proteins (~180) and assessing the proteins on a therapeutics pipeline.  They are also tracking all the new variants and providing summary reports to NIAID leadership."
Monkeypox Virus detection,Sequencing monkey pox virus from Chicago area wastewater,Epidemiology,DOE,Domestic,Ongoing,,,Scientists at Argonne are sequencing monkeypox from wastewater samples collected in the Chicago area to assess whether sequencing will be more consistent and more sensitive than some of the current qPCR/dPCR methods that have produced mixed results.
Evolution of monkeypox,Assessment of human enzyme cAPOBEC3 impacts on driving monkeypox evolution,Epidemiology,DOE,Domestic,Ongoing,,,"Scientists at Los Alamos recognized a very unusual pattern of mutation that is operative in HIV-1 evolution that is driving monkeypox evolution in the outbreak (and during its initial spread in 2017). The mutations in the outbreak viruses are driven by human enzyme cAPOBEC3, which is part of the innate immune system.  Other unusual mutation patterns are being defined, along with strategies for dealing with these issues for multiple alignments and studying monkeypox’s emergence in Nigeria. Computational modeling is being used to study the dynamics of distinctive variants to track evidence for evolutionary selection and to understand if the variants have implications for epidemic forecasting.  This work will enable a better understanding of monkeypox virus evolution."
Virus genome sequencing,Challenges in sequencing and assembling monkeypox viral genome,Epidemiology,DOE,Domestic,Ongoing,,,Scientists at Los Alamos are advising the CDC genomics group on how to best overcome some of the sequencing and assembly challenges that this large viral genome has compared with SARS-CoV-2
Molecular Therapeutics,Computational design of potential pan-orthopox anti-viral,Therapeutic,DOE,Domestic,Planned,,,Lawrence Livermore is conducting studies as part of the DoD/JPEO Generative Unconstrained Intelligent Drug Engineering (GUIDE) program to establish the feasibility of undertaking a computational design campaign to develop a pan-orthopoxvirus therapeutic/prophylactic antibody.
